[
  { "name": "--yeti-base", "group": "scale", "public": true, "declared": false, "default": "unset", "description": "Set to pin the body size at one value for every viewport; overrides both --yeti-base-min and --yeti-base-max." },
  { "name": "--yeti-ratio", "group": "scale", "public": true, "declared": false, "default": "unset", "description": "Set to pin the scale ratio at one value for every viewport; overrides both --yeti-ratio-min and --yeti-ratio-max." },
  { "name": "--yeti-base-min", "group": "scale", "public": true, "default": "1rem", "description": "Body text size at the narrow viewport." },
  { "name": "--yeti-base-max", "group": "scale", "public": true, "default": "1.125rem", "description": "Body text size at the wide viewport." },
  { "name": "--yeti-ratio-min", "group": "scale", "public": true, "default": "1.2", "description": "Scale ratio at the narrow viewport (minor third)." },
  { "name": "--yeti-ratio-max", "group": "scale", "public": true, "default": "1.333", "description": "Scale ratio at the wide viewport (perfect fourth)." },
  { "name": "--yeti-viewport-min", "group": "scale", "public": true, "default": "320px", "description": "Viewport width at which the narrow values apply." },
  { "name": "--yeti-viewport-max", "group": "scale", "public": true, "default": "1280px", "description": "Viewport width at which the wide values apply." },
  { "name": "--yeti-space-none", "group": "space", "public": true, "default": "0", "description": "No space; the value behind data-gap=\"none\"." },
  { "name": "--yeti-space-xs", "group": "space", "public": true, "default": "step -2", "description": "Hairline gap." },
  { "name": "--yeti-space-sm", "group": "space", "public": true, "default": "step -1", "description": "Tight gap." },
  { "name": "--yeti-space-md", "group": "space", "public": true, "default": "step 0", "description": "Default gap; equals the body text size." },
  { "name": "--yeti-space-lg", "group": "space", "public": true, "default": "step 1", "description": "Comfortable gap." },
  { "name": "--yeti-space-xl", "group": "space", "public": true, "default": "step 2", "description": "Section gap." },
  { "name": "--yeti-space-2xl", "group": "space", "public": true, "default": "step 3", "description": "Page-level gap." },
  { "name": "--yeti-space-3xl", "group": "space", "public": true, "default": "step 4", "description": "Hero-level gap." },
  { "name": "--yeti-space-xs-static", "group": "space", "public": true, "default": "step -2, narrow viewport value", "description": "Non-fluid xs, for a gap that must not scale." },
  { "name": "--yeti-space-sm-static", "group": "space", "public": true, "default": "step -1, narrow viewport value", "description": "Non-fluid sm." },
  { "name": "--yeti-space-md-static", "group": "space", "public": true, "default": "step 0, narrow viewport value", "description": "Non-fluid md." },
  { "name": "--yeti-space-lg-static", "group": "space", "public": true, "default": "step 1, narrow viewport value", "description": "Non-fluid lg." },
  { "name": "--yeti-space-xl-static", "group": "space", "public": true, "default": "step 2, narrow viewport value", "description": "Non-fluid xl." },
  { "name": "--yeti-space-2xl-static", "group": "space", "public": true, "default": "step 3, narrow viewport value", "description": "Non-fluid 2xl." },
  { "name": "--yeti-space-3xl-static", "group": "space", "public": true, "default": "step 4, narrow viewport value", "description": "Non-fluid 3xl." },
  { "name": "--yeti-radius-sm", "group": "radius", "public": true, "default": "0.25 × base", "description": "Small corner radius; inputs, code, badges." },
  { "name": "--yeti-radius-md", "group": "radius", "public": true, "default": "0.5 × base", "description": "Medium corner radius; cards, dialogs." },
  { "name": "--yeti-radius-lg", "group": "radius", "public": true, "default": "1 × base", "description": "Large corner radius; hero panels." },
  { "name": "--yeti-radius-full", "group": "radius", "public": true, "default": "9999px", "description": "Pill or circle." },
  { "name": "--yeti-width-xs", "group": "width", "public": true, "default": "16rem", "description": "Smallest container measure; the grid's default minimum column width." },
  { "name": "--yeti-width-sm", "group": "width", "public": true, "default": "24rem", "description": "The sidebar's default width." },
  { "name": "--yeti-width-md", "group": "width", "public": true, "default": "32rem", "description": "The columns layout's default threshold." },
  { "name": "--yeti-width-lg", "group": "width", "public": true, "default": "48rem", "description": "A narrow page column." },
  { "name": "--yeti-width-xl", "group": "width", "public": true, "default": "64rem", "description": "The center layout's default maximum." },
  { "name": "--yeti-width-2xl", "group": "width", "public": true, "default": "80rem", "description": "A wide page column." },
  { "name": "--yeti-text-xs", "group": "text", "public": true, "default": "step -2", "description": "Captions and fine print." },
  { "name": "--yeti-text-sm", "group": "text", "public": true, "default": "step -1", "description": "Small text; h6." },
  { "name": "--yeti-text-md", "group": "text", "public": true, "default": "step 0", "description": "Body text; h5 in bold." },
  { "name": "--yeti-text-lg", "group": "text", "public": true, "default": "step 1", "description": "Lead paragraphs; h4." },
  { "name": "--yeti-text-xl", "group": "text", "public": true, "default": "step 2", "description": "h3." },
  { "name": "--yeti-text-2xl", "group": "text", "public": true, "default": "step 3", "description": "h2." },
  { "name": "--yeti-text-3xl", "group": "text", "public": true, "default": "step 4", "description": "h1." },
  { "name": "--yeti-text-display", "group": "text", "public": true, "default": "step 5", "description": "Display type, larger than any heading." },
  { "name": "--yeti-leading-md", "group": "text", "public": true, "default": "1em + 0.5 × base", "description": "Body line height; about 1.5 at body size, tightening as type grows." },
  { "name": "--yeti-leading-tight", "group": "text", "public": true, "default": "1.15", "description": "Heading line height." },
  { "name": "--yeti-measure", "group": "text", "public": true, "default": "65ch", "description": "Maximum line length for prose." },
  { "name": "--yeti-font-sans", "group": "font", "public": true, "default": "system-ui, sans-serif", "description": "Default text face. Yeti ships no web fonts; override this to use yours." },
  { "name": "--yeti-font-mono", "group": "font", "public": true, "default": "ui-monospace, monospace", "description": "Code face." },
  { "name": "--yeti-duration-fast", "group": "motion", "public": true, "default": "150ms", "description": "Quick transitions; hover and focus. Collapses to 0.01ms under prefers-reduced-motion." },
  { "name": "--yeti-duration-base", "group": "motion", "public": true, "default": "250ms", "description": "Standard transitions; open and close. Collapses under prefers-reduced-motion." },
  { "name": "--yeti-ease", "group": "motion", "public": true, "default": "cubic-bezier(0.2, 0, 0, 1)", "description": "Default easing; fast out, gentle in." },
  { "name": "--yeti-hue-primary", "group": "hue", "public": true, "default": "250", "description": "Brand hue in oklch degrees; 250 is blue. Every primary color derives from it." },
  { "name": "--yeti-hue-secondary", "group": "hue", "public": true, "default": "300", "description": "Secondary hue; 300 is violet." },
  { "name": "--yeti-hue-success", "group": "hue", "public": true, "default": "145", "description": "Success hue; 145 is green." },
  { "name": "--yeti-hue-warning", "group": "hue", "public": true, "default": "80", "description": "Warning hue; 80 is amber." },
  { "name": "--yeti-hue-alert", "group": "hue", "public": true, "default": "25", "description": "Alert hue; 25 is red." },
  { "name": "--yeti-hue-neutral", "group": "hue", "public": true, "default": "var(--yeti-hue-primary)", "description": "Hue that faintly tints surfaces, text, and borders. Follows the primary hue unless set." },
  { "name": "--yeti-chroma", "group": "hue", "public": true, "default": "0.15", "description": "Accent saturation. Lower for a calmer palette; 0.2 and above may clip on very saturated hues." },
  { "name": "--yeti-color-primary", "group": "color", "public": true, "default": "ladder base of the primary hue", "description": "The brand color: buttons, links, focus." },
  { "name": "--yeti-color-primary-subtle", "group": "color", "public": true, "default": "ladder subtle", "description": "Tinted background; hover on surfaces, selection." },
  { "name": "--yeti-color-primary-soft", "group": "color", "public": true, "default": "ladder soft", "description": "Borders and dividers in the primary hue." },
  { "name": "--yeti-color-primary-strong", "group": "color", "public": true, "default": "ladder strong", "description": "Hover and active state of the primary color." },
  { "name": "--yeti-color-primary-text", "group": "color", "public": true, "default": "ladder text", "description": "Primary-hued text on plain surfaces." },
  { "name": "--yeti-on-primary", "group": "color", "public": true, "default": "near-white in light, near-black in dark", "description": "Text placed on --yeti-color-primary." },
  { "name": "--yeti-color-secondary", "group": "color", "public": true, "default": "ladder base of the secondary hue", "description": "Secondary accent." },
  { "name": "--yeti-color-secondary-subtle", "group": "color", "public": true, "default": "ladder subtle", "description": "Tinted background in the secondary hue." },
  { "name": "--yeti-color-secondary-soft", "group": "color", "public": true, "default": "ladder soft", "description": "Borders in the secondary hue." },
  { "name": "--yeti-color-secondary-strong", "group": "color", "public": true, "default": "ladder strong", "description": "Hover and active state of the secondary color." },